{
  "schema_name": "gunnchos.controlled_dataset_manifest",
  "schema_version": "1.0.0",
  "dataset_id": "gate3-controlled-20260722",
  "collection_start_date": "",
  "collection_end_date": "",
  "n_sessions": 0,
  "n_locations": 0,
  "location_categories": [],
  "n_network_conditions": 0,
  "network_conditions": [],
  "n_distinct_days": 0,
  "workload_profile_coverage": {
    "learn": 0,
    "create": 0,
    "sense": 0
  },
  "device_model_categories": [],
  "collector_versions": [],
  "repository_commits": {
    "gunnchos-7gc-ai-ran-field-kit": "82099df12323c9b689e55f8a1169781416e406b5",
    "edge-io-measurement-node": "9d04dd5bf3b726b21b76718ee80c7c2f5c6c18f7"
  },
  "consent_status_summary": {
    "active": 0,
    "withdrawn": 0,
    "pending": 0,
    "rejected": 0
  },
  "withdrawal_count": 0,
  "deletion_count": 0,
  "privacy_review_result": "pass",
  "prohibited_field_scan_result": "pass",
  "raw_data_storage_policy": "local_only_gitignored",
  "sanitized_data_path": "/agent/repos/gunnchos-7gc-ai-ran-field-kit/results/gate3/gate3-run-20260722T160425Z/gate3-controlled-20260722/controlled_dataset/sessions",
  "session_hashes": {},
  "dataset_hash": "42667c1bb3f579271cb1affc34baccb1d3374128fe2d336dd3fa4dcdee838580",
  "evidence_level": "controlled_device_measurement",
  "missing_cells": [
    "day_01_zone_a_wifi_normal_learn",
    "day_01_zone_a_wifi_normal_create",
    "day_01_zone_a_wifi_normal_sense",
    "day_01_zone_a_wifi_degraded_learn",
    "day_01_zone_a_wifi_degraded_create",
    "day_01_zone_a_wifi_degraded_sense",
    "day_01_zone_b_wifi_normal_learn",
    "day_01_zone_b_wifi_normal_create",
    "day_01_zone_b_wifi_normal_sense",
    "day_01_zone_b_wifi_degraded_learn",
    "day_01_zone_b_wifi_degraded_create",
    "day_01_zone_b_wifi_degraded_sense",
    "day_01_zone_c_wifi_normal_learn",
    "day_01_zone_c_wifi_normal_create",
    "day_01_zone_c_wifi_normal_sense",
    "day_01_zone_c_wifi_degraded_learn",
    "day_01_zone_c_wifi_degraded_create",
    "day_01_zone_c_wifi_degraded_sense",
    "day_02_zone_a_wifi_normal_learn",
    "day_02_zone_a_wifi_normal_create",
    "day_02_zone_a_wifi_normal_sense",
    "day_02_zone_a_wifi_degraded_learn",
    "day_02_zone_a_wifi_degraded_create",
    "day_02_zone_a_wifi_degraded_sense",
    "day_02_zone_b_wifi_normal_learn",
    "day_02_zone_b_wifi_normal_create",
    "day_02_zone_b_wifi_normal_sense",
    "day_02_zone_b_wifi_degraded_learn",
    "day_02_zone_b_wifi_degraded_create",
    "day_02_zone_b_wifi_degraded_sense",
    "day_02_zone_c_wifi_normal_learn",
    "day_02_zone_c_wifi_normal_create",
    "day_02_zone_c_wifi_normal_sense",
    "day_02_zone_c_wifi_degraded_learn",
    "day_02_zone_c_wifi_degraded_create",
    "day_02_zone_c_wifi_degraded_sense",
    "day_03_zone_a_wifi_normal_learn",
    "day_03_zone_a_wifi_normal_create",
    "day_03_zone_a_wifi_normal_sense",
    "day_03_zone_a_wifi_degraded_learn",
    "day_03_zone_a_wifi_degraded_create",
    "day_03_zone_a_wifi_degraded_sense",
    "day_03_zone_b_wifi_normal_learn",
    "day_03_zone_b_wifi_normal_create",
    "day_03_zone_b_wifi_normal_sense",
    "day_03_zone_b_wifi_degraded_learn",
    "day_03_zone_b_wifi_degraded_create",
    "day_03_zone_b_wifi_degraded_sense",
    "day_03_zone_c_wifi_normal_learn",
    "day_03_zone_c_wifi_normal_create",
    "day_03_zone_c_wifi_normal_sense",
    "day_03_zone_c_wifi_degraded_learn",
    "day_03_zone_c_wifi_degraded_create",
    "day_03_zone_c_wifi_degraded_sense"
  ],
  "protocol_deviations": [],
  "known_limitations": [
    "Counts are computed from eligible sanitized session files only.",
    "Raw device files remain gitignored until human publication approval."
  ],
  "counts_computed_from_sessions": true
}
